{
  "manifest_version": "skill-manifest.v1",
  "backend": "agents",
  "skill_id": "repo-whats-next-skill",
  "canonical_dir": "product/harness/skills/repo-whats-next-skill",
  "entrypoint": "references/entrypoints.md",
  "included_paths": [
    "SKILL.md",
    "references/entrypoints.md",
    "references/priority-reframe-mode.md"
  ],
  "target_dir": "skills/repo-whats-next-skill",
  "first_wave_profile": "a3-first-wave",
  "first_wave_scope_kind": "subset-by-a3-freeze",
  "supported_repo_actions": [
    "enter-worktrack",
    "hold-and-observe"
  ]
}
