{
  "manifest_version": "skill-manifest.v1",
  "backend": "agents",
  "skill_id": "repo-status-skill",
  "canonical_dir": "product/harness/skills/repo-status-skill",
  "entrypoint": "references/entrypoints.md",
  "included_paths": [
    "SKILL.md",
    "references/entrypoints.md"
  ],
  "target_dir": "skills/repo-status-skill",
  "first_wave_profile": "a3-first-wave",
  "first_wave_scope_kind": "full-skill"
}
