{
  "manifest_version": "skill-manifest.v1",
  "backend": "agents",
  "skill_id": "init-worktrack-skill",
  "canonical_dir": "product/harness/skills/init-worktrack-skill",
  "entrypoint": "references/entrypoints.md",
  "included_paths": [
    "SKILL.md",
    "references/entrypoints.md",
    "templates/contract.template.md"
  ],
  "target_dir": "init-worktrack-skill",
  "first_wave_profile": "a3-first-wave",
  "first_wave_scope_kind": "subset-by-a3-freeze"
}
